{
  "schema_version": "sensei.workspace.identity.v1",
  "generated_by": "sensei workspacecontract",
  "composition_state": "complete",
  "binding": {
    "repository_domain": "github.com/globulario/sensei",
    "revision": "abc123def456abc123def456abc123def456abc",
    "revision_status": "resolved",
    "tree_digest_sha256": "1111111111111111111111111111111111111111111111111111111111111111",
    "graph_digest_sha256": null,
    "graph_digest_status": "not_requested"
  },
  "repository_domain_source": "configured",
  "graph_authority": {
    "authoritative": true,
    "graph_freshness_state": "GRAPH_FRESHNESS_STATE_CURRENT",
    "graph_freshness_detail": "live store matches expected validated graph artifact",
    "seed_state": "SEED_STATE_CURRENT",
    "build_provenance_state": "BUILD_PROVENANCE_STATE_STAMPED",
    "live_store_graph_digest_sha256": "3333333333333333333333333333333333333333333333333333333333333333",
    "live_store_graph_triple_count": 12345,
    "embedded_seed_digest_sha256": "3333333333333333333333333333333333333333333333333333333333333333",
    "embedded_transaction_stamp_present": true,
    "embedded_transaction_matches_seed": true,
    "certified_awareness_graph_commit": "e1985d74b9349b4f90e3a54e3c0312d177a5d239",
    "certified_services_repo_commit": "eb6610554158444871178afca0626a1ee8d66056"
  },
  "coverage_state": "COVERAGE_STATE_SUFFICIENT",
  "task_identity": {
    "state": "resolved",
    "task_id": "task.feat_workspace_identity.a1b2c3d4e5f6"
  },
  "limitations": []
}
